{
    "$schema": "http://json-schema.org/draft-07/schema",
    "name": "bse_basis_set_component",
    "version": "0.1",
    "url": "TODO",
    "description": "Basis Set Exchange - A component of a basis set",
    "type": "object",
    "additionalProperties": false,
    "required": [
        "molssi_bse_schema",
        "description",
        "data_source",
        "elements"
    ],
    "properties":
    {
        "molssi_bse_schema": {
            "description": "Info about which schema the file follows",
            "type": "object",
            "additionalProperties": false,
            "required": [
                "schema_type",
                "schema_version"
            ],
            "properties": {
                "schema_type" : {
                    "description": "What type of BSE JSON file this is",
                    "type": "string",
                    "enum": [ "component" ]
                },
                "schema_version": {
                    "description": "Version of the BSE basis set component schema being used",
                    "type": "string"
                }
            }
        },
        "description": {
            "description": "Brief description of the basis set",
            "type": "string"
        },
        "data_source": {
            "description": "Where the actual numbers in this file came from",
            "type": "string"
        },
        "notes": {
            "description": "Any notes pertaining to this basis set",
            "type": "string"
        },
        "elements": {
            "description": "Data for the elements of the basis set",
            "type": "object",
            "additionalProperties": false,
            "patternProperties":   {
                "^\\d+$" : {
                    "description": "Data for a single element or atom in the basis set",
                    "type": "object",
                    "required": [
                        "references"
                    ],
                    "additionalProperties": false,
                    "properties": {
                        "references": {
                            "$ref": "common-definitions.json#reference_keys"
                        },
                        "electron_shells": {
                            "$ref": "common-definitions.json#electron_shell_list"
                        },
                        "ecp_electrons":
                        {
                            "$ref": "common-definitions.json#ecp_electrons"
                        },
                        "ecp_potentials": {
                            "$ref": "common-definitions.json#ecp_potential_list"
                        }
                    }
                }
            }
        }
    }
}
