{
  "molssi_bse_schema": {
    "schema_type": "component",
    "schema_version": "0.1"
  },
  "description": "Even-tempered PsX-DZ positronic basis",
  "data_source": "Data from supporting information",
  "elements": {
    "1": {
      "references": [
        "moncada2020a"
      ],
      "electron_shells": [
        {
          "function_type": "gto",
          "region": "",
          "angular_momentum": [
            0
          ],
          "exponents": [
            "1.900000000e-02"
          ],
          "coefficients": [
            [
              "1.0"
            ]
          ]
        },
        {
          "function_type": "gto",
          "region": "",
          "angular_momentum": [
            0
          ],
          "exponents": [
            "5.194600000e-02"
          ],
          "coefficients": [
            [
              "1.0"
            ]
          ]
        },
        {
          "function_type": "gto",
          "region": "",
          "angular_momentum": [
            0
          ],
          "exponents": [
            "1.420203640e-01"
          ],
          "coefficients": [
            [
              "1.0"
            ]
          ]
        },
        {
          "function_type": "gto",
          "region": "",
          "angular_momentum": [
            0
          ],
          "exponents": [
            "3.882836752e-01"
          ],
          "coefficients": [
            [
              "1.0"
            ]
          ]
        },
        {
          "function_type": "gto",
          "region": "",
          "angular_momentum": [
            0
          ],
          "exponents": [
            "1.061567568e+00"
          ],
          "coefficients": [
            [
              "1.0"
            ]
          ]
        },
        {
          "function_type": "gto",
          "region": "",
          "angular_momentum": [
            1
          ],
          "exponents": [
            "5.910000000e-02"
          ],
          "coefficients": [
            [
              "1.0"
            ]
          ]
        },
        {
          "function_type": "gto",
          "region": "",
          "angular_momentum": [
            1
          ],
          "exponents": [
            "1.612839000e-01"
          ],
          "coefficients": [
            [
              "1.0"
            ]
          ]
        },
        {
          "function_type": "gto",
          "region": "",
          "angular_momentum": [
            1
          ],
          "exponents": [
            "4.401437631e-01"
          ],
          "coefficients": [
            [
              "1.0"
            ]
          ]
        },
        {
          "function_type": "gto_spherical",
          "region": "",
          "angular_momentum": [
            2
          ],
          "exponents": [
            "1.165000000e-01"
          ],
          "coefficients": [
            [
              "1.0"
            ]
          ]
        },
        {
          "function_type": "gto_spherical",
          "region": "",
          "angular_momentum": [
            2
          ],
          "exponents": [
            "3.128025000e-01"
          ],
          "coefficients": [
            [
              "1.0"
            ]
          ]
        }
      ]
    }
  }
}